{"audience":"furatena.preview","binding":{"head_sha":"aaaaaaaaaaaaaaaaaaaaaaaaaaaaaaaaaaaaaaaa","origin":"https://pr-518.preview.example","pull_request_number":518,"repository_id":"repository-4242"},"client_kind":"browser","code":"ccccccccccccccccccccccccccccccccccccccccccc","code_verifier":"verify-this-preview-code-with-pkce-s256-only-1234567890","exchange_id":"eeeeeeeeeeeeeeeeeeeeeeeeeeeeeeeeeeeeeeeeeee","exchanged_at":"2030-01-01T00:01:30Z","nonce":"bbbbbbbbbbbbbbbbbbbbbbbbbbbbbbbbbbbbbbbbbbb","record_type":"furatena.preview-auth.grant-exchange","redirect_uri":"https://pr-518.preview.example/_fura/preview-auth/callback","schema_version":1}
